,PaperID,Decision,Title,Abstract,Keyword,Comment
249,S1QefL5ge,Invite to Workshop Track,Online Structure Learning for Sum-Product Networks with Gaussian Leaves,"Sum-product networks have recently emerged as an attractive representation due to their dual view as a special type of deep neural network with clear semantics and a special type of probabilistic graphical model for which inference is always tractable. Those properties follow from some conditions (i.e., completeness and decomposability) that must be respected by the structure of the network.  As a result, it is not easy to specify a valid sum-product network by hand and therefore structure learning techniques are typically used in practice.  This paper describes the first {\em online} structure learning technique for continuous SPNs with Gaussian leaves. We also introduce an accompanying new parameter learning technique.","['Unsupervised Learning', 'Deep learning']","The authors present a framework for online structure learning of sum-product network. They overcome challenges such as being able to learn a valid sum product network and to have an online learning mechanism. Based on the extensive discussions presented by the reviewers, our recommendation is to accept this paper for a workshop."
250,BJAA4wKxg,Reject,A Convolutional Encoder Model for Neural Machine Translation,"The prevalent approach to neural machine translation relies on bi-directional LSTMs to encode the source sentence.
In this paper we present a faster and simpler architecture based on a succession of convolutional layers. 
This allows to encode the entire source sentence simultaneously compared to recurrent networks for which computation is constrained by temporal dependencies.
On WMT'16 English-Romanian translation we achieve competitive accuracy to the state-of-the-art and we outperform several recently published results on the WMT'15 English-German task. 
Our models obtain almost the same accuracy as a very deep LSTM setup on WMT'14 English-French translation.
Our convolutional encoder speeds up CPU decoding by more than two times at the same or higher accuracy as a strong bi-directional LSTM baseline. ",[],"This work demonstrates architectural choices to make conv nets work for NMT. In general the reviewers liked the work and were convinced by the results but found the main contributions to be ""incremental"". 
 
 Pros:
 - Clarity: The work was clearly presented, and besides for minor comments (diagrams) the reviewers understood the work
 - Quality: The experimental results were thorough, ""very extensive and leaves no doubt that the proposed approach works well"".
 
 Mixed:
 - Novelty: There is appreciation that the work is novel. However as the work is somewhat ""application-specific"" the reviewers felt the technical contribution was not an overwhelming contribution.
 - Impact: While some speed ups were shown, not all reviewers were convinced that the benefit was sufficient, or ""main speed-up factor(s)"" were. 
 
 This work is clearly worthwhile, but the reviews place it slightly below the top papers in this area."
251,ByG8A7cee,Reject,Reference-Aware Language Models,"We propose a general class of language models that treat reference as an explicit stochastic latent variable. This architecture allows models to create mentions of entities and their attributes by accessing external databases (required by, e.g., dialogue generation and recipe generation) and internal state (required by, e.g. language models which are aware of coreference). This facilitates the incorporation of information that can be accessed in predictable locations in databases or dis- course context, even when the targets of the reference may be rare words. Experiments on three tasks show our model variants outperform models based on deterministic attention.","['Natural language processing', 'Deep learning']","All of the reviewers point out clarity problems; while these may have been resolved in an updated version, the reviewers have not expressed that the matter is resolved. There are several questions raised about the use of perplexity, both whether the comparison is fair, and whether it is a valid proxy for more standard measures in NLP. The former seems to be more of an issue for this area chair, and the discussion did not convince me that it was adequately resolved."
252,HJF3iD9xe,Invite to Workshop Track,Deep Learning with Sets and Point Clouds,"We introduce a simple permutation equivariant layer for deep learning with set structure. This type of layer, obtained by parameter-sharing, has a simple implementation and linear-time complexity in the size of each set. We use deep permutation-invariant networks to perform point-could classification and MNIST digit summation, where in both cases the output is invariant to permutations of the input. In a semi-supervised setting, where the goal is make predictions for each instance within a set, we demonstrate the usefulness of this type of layer in set-outlier detection as well as semi-supervised learning with clustering side-information.","['Deep learning', 'Structured prediction', 'Computer vision', 'Supervised Learning', 'Semi-Supervised Learning']","This paper studies neural models that can be applied to set-structured inputs and thus require permutation invariance or equivariance. After a first section that introduces necessary and sufficient conditions for permutation invariance/equivariance, the authors present experiments in supervised and semi-supervised learning on point-cloud data as well as cosmology data.
 
 The reviewers agreed that this is a very promising line of work and acknowledged the effort of the authors to improve their paper after the initial discussion phase. However, they also agree that the work appears to be missing more convincing numerical experiments and insights on the choice of neural architectures in the class of permutation-covariant. 
 
 In light of these reviews, the AC invites their work to the workshop track. 
 Also, I would like to emphasize an aspect of this work that I think should be addressed in the subsequent revision.
 
 As the authors rightfully show (thm 2.1), permutation equivariance puts very strong constraints in the class of 1-layer networks. This theorem, while rigorous, reflects a simple algebraic property of matrices that commute with permutation matrices. It is therefore not very surprising, and the resulting architecture relatively obvious. So much so that it already exists in the literature. In fact, it is a particular instance of the graph neural network model of Scarselli et al. '09 (http://ieeexplore.ieee.org/abstract/document/4700287/) when you consider a complete graph, which has been used in the setup of full set equivariance for example in 'Learning Multiagent communication with backpropagation', Sukhbaatar et al NIPS'16; see also 'Order Matters: sequence to sequence for sets', Vinyals et al. https://arxiv.org/abs/1511.06391. 
 The general question of how to model point-cloud data, or more generally data defined over graphs, with neural networks is progressing rapidly; see for example https://arxiv.org/abs/1611.08097 for a recent survey.
 
 The question then is what is the contribution of the present work relative to this line of work. The authors should answer this question explicitly in the revised manuscript, either with a new application of the model, or with theory that advances our understanding of these models, or with new numerical applications."
253,rkYmiD9lg,Invite to Workshop Track,Exponential Machines,"Modeling interactions between features improves the performance of machine learning solutions in many domains (e.g. recommender systems or sentiment analysis). In this paper, we introduce Exponential Machines (ExM), a predictor that models all interactions of every order. The key idea is to represent an exponentially large tensor of parameters in a factorized format called Tensor Train (TT). The Tensor Train format regularizes the model and lets you control the number of underlying parameters. To train the model, we develop a stochastic Riemannian optimization procedure, which allows us to fit tensors with 2^160 entries. We show that the model achieves state-of-the-art performance on synthetic data with high-order interactions and that it works on par with high-order factorization machines on a recommender system dataset MovieLens 100K.","['Supervised Learning', 'Optimization']","Modeling nonlinear interactions between variables by imposing Tensor-train structure on parameter matrices is certainly an elegant and novel idea. All reviewers acknowledge this to be the case. But they are also in agreement that the experimental section of this paper is somewhat weak relative to the rest of the paper, making this paper borderline. A revised version of this paper that takes reviewer feedback into account is invited to the workshop track."
254,S1OufnIlx,Invite to Workshop Track,Adversarial examples in the physical world,"Most existing machine learning classifiers are highly vulnerable to adversarial examples.
An adversarial example is a sample of input data which has been modified
very slightly in a way that is intended to cause a machine learning classifier
to misclassify it.
In many cases, these modifications can be so subtle that a human observer does
not even notice the modification at all, yet the classifier still makes a mistake.
Adversarial examples pose security concerns
because they could be used to perform an attack on machine learning systems, even if the adversary has no
access to the underlying model.
Up to now, all previous work has assumed a threat model in which the adversary can
feed data directly into the machine learning classifier.
This is not always the case for systems operating in the physical world,
for example those which are using signals from cameras and other sensors as input.
This paper shows that even in such physical world scenarios, machine learning systems are vulnerable
to adversarial examples.
We demonstrate this by feeding adversarial images obtained from a cell-phone camera
to an ImageNet Inception classifier and measuring the classification accuracy of the system.
We find that a large fraction of adversarial examples are classified incorrectly
even when perceived through the camera.","['Supervised Learning', 'Computer vision']","This paper studies an interesting aspect of adversarial training with important practical applications: its robustness against transformations that correspond to physical world constraints. The paper demonstrates how to construct adversarial examples such that they can be used to attack a machine-learning device through a physical interface such as a camera device. 
 
 The reviewers agreed that this is a well-written paper which clearly describes its contributions and offers a detailed experimental section. The authors took into account the reviewer's concerns and the rebuttal phase offered interesting discussions. 
 
 In light of the reviews, the main critique of this work is its lack of significance, relative to existing works in adversarial examples. The authors, however, did a good job during the rebuttal phase to highlight the empirical nature of the work and the potential practical significance of their findings in the design of ML models. The AC concludes that the potential practical applications, while not significant enough to be part of the conference proceedings, are worthy to be disseminated in the workshop. I therefore recommend submitting this work to the workshop track."
255,Hy-2G6ile,Invite to Workshop Track,Gated Multimodal Units for Information Fusion,"This paper presents a novel model for multimodal learning based on gated neural networks. The Gated Multimodal Unit (GMU) model is intended to be used as an internal unit in a neural network architecture whose purpose is to find an intermediate representation based on a combination of data from different modalities. The GMU learns to decide how modalities influence the activation of the unit using multiplicative gates. It was evaluated on a multilabel scenario for genre classification of movies using the plot and the poster. The GMU improved the macro f-score performance of single-modality approaches and outperformed other fusion strategies, including mixture of experts models. Along with this work, the MM-IMDb dataset is released which, to the best of our knowledge, is the largest publicly available multimodal dataset for genre prediction on movies.","['Multi-modal learning', 'Applications', 'Supervised Learning']","The authors propose a Gated Muiltimodal Unit to combine multi-modal information (visual and textual). They also collect a large dataset of movie summers and posters. Overall, the reviewers were quite positive, while AR4 points to related models and feels that the contribution in the current version is too weak for ICLR. The AC read the paper and the authors responses but tends to agree with AR4. The authors are encouraged to strengthen their work and resubmit to a future conference."
256,BkmM8Dceg,Reject,Warped Convolutions: Efficient Invariance to Spatial Transformations,"Convolutional Neural Networks (CNNs) are extremely efficient, since they exploit the inherent translation-invariance of natural images. However, translation is just one of a myriad of useful spatial transformations. Can the same efficiency be attained when considering other spatial invariances? Such generalized convolutions have been considered in the past, but at a high computational cost. We present a construction that is simple and exact, yet has the same computational complexity that standard convolutions enjoy. It consists of a constant image warp followed by a simple convolution, which are standard blocks in deep learning toolboxes. With a carefully crafted warp, the resulting architecture can be made equivariant to a wide range of 2-parameters spatial transformations. We show encouraging results in realistic scenarios, including the estimation of vehicle poses in the Google Earth dataset (rotation and scale), and face poses in Annotated Facial Landmarks in the Wild (3D rotations under perspective).",[],"The reviewers found the idea interesting and practical but had concerns about the novelty of the approach and the claims and theory presented in the paper. In particular, it seems that the reviewers feel that the authors' claim to present novel theory is unjustified (i.e. the theorems presented are not novel). Also claims regarding the advantages of this approach relative to related literature (in particular Dieleman et al. and Cohen & Welling) seem to be unsubstantiated. This work would likely be more well received just through rewriting the manuscript with, as stated by AnonReviewer3, ""a more thorough and balanced appraisal of the merits and demerits, as well as the novelty, relative to each of the previous works"" and weakening the claims of novel theory."
257,BJbD_Pqlg,Reject,Human perception in computer vision,"Computer vision has made remarkable progress in recent years. Deep neural network (DNN) models optimized to identify objects in images exhibit unprecedented task-trained accuracy and, remarkably, some generalization ability: new visual problems can now be solved more easily based on previous learning. Biological vision (learned in life and through evolution) is also accurate and general-purpose. Is it possible that these different learning regimes converge to similar problem-dependent optimal computations? We therefore asked whether the human system-level computation of visual perception has DNN correlates and considered several anecdotal test cases. We found that perceptual sensitivity to image changes has DNN mid-computation correlates, while sensitivity to segmentation, crowding and shape has DNN end-computation correlates. Our results quantify the applicability of using DNN computation to estimate perceptual loss, and are consistent with the fascinating theoretical view that properties of human perception are a consequence of architecture-independent visual learning.","['Computer vision', 'Transfer Learning']","I think the reviewers evaluated this paper very carefully and were well balanced. The reviewers all agree that the presented comparison between human vision and DNNs is interesting. At the same time, none of the reviewers would strongly defend the paper. As it stands, this work seems a little too premature for publication as the analysis does not go too much beyond what we already know. We encourage the authors to deepen the investigation and resubmit."
258,HJhcg6Fxg,Reject,Binary Paragraph Vectors,"Recently Le & Mikolov described two log-linear models, called Paragraph Vector, that can be used to learn state-of-the-art distributed representations of documents. Inspired by this work, we present Binary Paragraph Vector models: simple neural networks that learn short binary codes for fast information retrieval. We show that binary paragraph vectors outperform autoencoder-based binary codes, despite using fewer bits. We also evaluate their precision in transfer learning settings, where binary codes are inferred for documents unrelated to the training corpus. Results from these experiments indicate that binary paragraph vectors can capture semantics relevant for various domain-specific documents. Finally, we present a model that simultaneously learns short binary codes and longer, real-valued representations. This model can be used to rapidly retrieve a short list of highly relevant documents from a large document collection.","['Natural language processing', 'Transfer Learning']","This paper proposes to binarize Paragraph Vector distributed representations in an end-to-end framework. Experiments demonstrate that this beats autoencoder-based binary codes. However, the performance is similar to using paragraph vectors followed by existing binarization techniques, failing to show an advantage of training end-to-end. Therefore, the novel contribution seems too limited for publication."
259,BJRIA3Fgg,Invite to Workshop Track,Modularized Morphing of Neural Networks,"In this work we study the problem of network morphism, an effective learning scheme to morph a well-trained neural network to a new one with the network function completely preserved. Different from existing work where basic morphing types on the layer level were addressed, we target at the central problem of network morphism at a higher level, i.e., how a convolutional layer can be morphed into an arbitrary module of a neural network. To simplify the representation of a network, we abstract a module as a graph with blobs as vertices and convolutional layers as edges, based on which the morphing process is able to be formulated as a graph transformation problem. Two atomic morphing operations are introduced to compose the graphs, based on which modules are classified into two families, i.e., simple morphable modules and complex modules. We present practical morphing solutions for both of these two families, and prove that any reasonable module can be morphed from a single convolutional layer. Extensive experiments have been conducted based on the state-of-the-art ResNet on benchmark datasets, and the effectiveness of the proposed solution has been verified.","['Deep learning', 'Computer vision']","The paper investigates the problem of morphing one convolutional network into another with application to exploring the model space (starting from a pre-trained baseline model). The resulting morphed models perform better than the baseline, albeit at the cost of more parameters and training. Importantly, it has not been demonstrated that morphing leads to training time speed-up, which is an important factor to consider when exploring new architectures starting from pre-trained models. Still, the presented approach and the experiments would be of interest to the community, so I recommend the paper for workshop presentation."
260,HyecJGP5ge,Reject,NEUROGENESIS-INSPIRED DICTIONARY LEARNING: ONLINE MODEL ADAPTION IN A CHANGING WORLD,"In this paper, we focus on online representation learning in non-stationary environments which may require continuous adaptation of model’s architecture. We propose a novel online dictionary-learning (sparse-coding) framework which incorporates the addition and deletion of hidden units (dictionary elements), and is inspired by the adult neurogenesis phenomenon in the dentate gyrus of the hippocampus, known to be associated with improved cognitive function and adaptation to new environments. In the online learning setting, where new input instances arrive sequentially in batches, the “neuronal birth” is implemented by adding new units with random initial weights (random dictionary elements); the number of new units is determined by the current performance (representation error) of the dictionary, higher error causing an increase in the birth rate. “Neuronal death” is implemented by imposing l1/l2-regularization (group sparsity) on the dictionary within the block-coordinate descent optimization at each iteration of our online alternating minimization scheme, which iterates between the code and dictionary updates. Finally, hidden unit connectivity adaptation is facilitated by introducing sparsity in dictionary elements. Our empirical evaluation on several real-life datasets (images and language) as well as on synthetic data demonstrates that the proposed approach can considerably outperform the state-of-art fixed-size (nonadaptive) online sparse coding of Mairal et al. (2009) in the presence of nonstationary data. Moreover, we identify certain properties of the data (e.g., sparse inputs with nearly non-overlapping supports) and of the model (e.g., dictionary sparsity) associated with such improvements.","['Unsupervised Learning', 'Computer vision', 'Transfer Learning', 'Optimization', 'Applications']","This paper combines simple heuristics to adapt the size of a dictionary during learning. The heuristics are intuitive: augmenting the dictionary size when correlation between reconstruction and inputs falls below a certain pre-determined threshold, reducing the dictionary size by adding a group-sparsity L1,2 penalty on the overall dictionary (the L1,2 penalty for pruning models had appeared elsewhere before, as the authors acknowledge).
 The topic of online adjustment of model complexity is an important one, and work like this is an interesting and welcome direction. The simplicity of the heuristics presented here would be appealing if there was more empirical support to demonstrate the usefulness of the proposed adaptation. However, the empirical validation falls short here:
 - the claim that this work offers more than existing off-line model adaptation methods because of its online setting is the crux of the value of the paper, but the experimental validation does not offer much in terms of how to adjust hyperparameters to a truly nonstationary setting. Here, the hyperparameters are set rather arbitrarily, and the experimental setting is a single switch between two datasets (where off-line methods would do well), so this obscures the challenges that would be presented by a less artificial level of non-stationarity
 - an extensive set of experiments is presented, but all these experiments are confined in a strange experimental setting that is divorced from any practical metrics: the ""state-of-the-art"" method of reference is Mairal et al 2009 which was focused on speeding learning of dictionaries. Here, the metrics offered are correlation / reconstruction error, and classification, over full images instead of patches as is usually done for large images, without justification. This unnecessarily puts the work in a vacuum in terms of evaluation and comparison to existing art. In fact, the reconstructions in the appendix Fig. 17 and 18 look pretty bad, and the classification performance 1) does not demonstrate superiority of the method over standard dictionary learning (both lines are within the error bars and virtually indistinguishable if using more than 60 elements, which is not much), 2) performance overall is pretty bad for a 2-class discrimination task, again because of the unusual setting of using full images.
 In summary, this paper could be a very nice paper if the ideas were validated in a way that shows true usefulness and true robustness to the challenges of realistic nonstationarity, but this is unfortunately not the case here.
 Ps: two recent papers that could be worth mentioning in terms of model adaptation are diversity networks for pruning neurons (Diversity Networks, Mariet and Sra ICLR 2016, https://arxiv.org/abs/1511.05077), and augmenting neural networks with extra parameters while retaining previous learning (Progressive Neural Networks, Rusu et al 2016, https://arxiv.org/pdf/1606.04671v3.pdf)."
