,PaperID,Decision,Title,Abstract,Keyword,Comment
351,rJsiFTYex,Reject,A Way out of the Odyssey: Analyzing and Combining Recent Insights for LSTMs,"LSTMs have become a basic building block for many deep NLP models. In recent years, many improvements and variations have been proposed for deep sequence models in general, and LSTMs in particular. We propose and analyze a series of architectural modifications for LSTM networks resulting in improved performance for text classification datasets. We observe compounding improvements on traditional LSTMs using Monte Carlo test-time model averaging, deep vector averaging (DVA), and residual connections, along with four other suggested modifications. Our analysis provides a simple, reliable, and high quality baseline model.","['Natural language processing', 'Deep learning', 'Supervised Learning']","The paper attempts to perform an interesting exploration (how to combine different tricks for LSTM training) but does not take it far enough. 
 
 Pros:
 - interesting attempt at studying different techniques to improve LSTM training results
 Cons:
 - not very strong baselines
 - limited set of domains were explored
 - low in novelty (which wouldn't be a problem if the comparison was more thorough -- see above 2 points)."
352,BkjLkSqxg,Reject,LipNet: End-to-End Sentence-level Lipreading,"Lipreading is the task of decoding text from the movement of a speaker's mouth. Traditional approaches separated the problem into two stages: designing or learning visual features, and prediction. More recent deep lipreading approaches are end-to-end trainable (Wand et al., 2016; Chung & Zisserman, 2016a). However, existing work on models trained end-to-end perform only word classification, rather than sentence-level sequence prediction. Studies have shown that human lipreading performance increases for longer words (Easton & Basala, 1982), indicating the importance of features capturing temporal context in an ambiguous communication channel. Motivated by this observation, we present LipNet, a model that maps a variable-length sequence of video frames to text, making use of spatiotemporal convolutions, a recurrent network, and the connectionist temporal classification loss, trained entirely end-to-end. To the best of our knowledge, LipNet is the first end-to-end sentence-level lipreading model that simultaneously learns spatiotemporal visual features and a sequence model. On the GRID corpus, LipNet achieves 95.2% accuracy in sentence-level, overlapped speaker split task, outperforming experienced human lipreaders and the previous 86.4% word-level state-of-the-art accuracy (Gergen et al., 2016).","['Computer vision', 'Deep learning']","Let me start by saying that your area chair does not read Twitter, Reddit/ML, etc. The metareview below is, therefore, based purely on the manuscript and the reviews and rebuttal on OpenReview.
 
 The goal of the ICLR review process is to establish a constructive discussion between the authors of a paper on one side and reviewers and the broader machine-learning community on the other side. The goal of this discussion is to help the authors leverage the community for improving their manuscript.
 
 Whilst one may argue that some of the initial reviews could have provided a more detailed motivation for their rating, there is no evidence that the reviewers were influenced (or even aware of) discussions about this paper on social or other media --- in fact, none of the reviews refers to claims made in those media. Suggestions by the authors that the reviewers are biased by (social) media are, therefore, unfounded: there can be many valid reasons for the differences in opinion between reviewers and authors on the novelty, originality, or importance of this work. The authors are free to debate the opinion of the reviewers, but referring to the reviews as ""absolute nonsense"", ""unreasonable"", ""condescending"", and ""disrespectful"" is not helping the constructive scientific discussion that ICLR envisions and, frankly, is very offensive to reviewers who voluntarily spend their time in order to improve the quality of scientific research in our field.
 
 Two area chairs have read the paper. They independently reached the conclusion that (1) the reviewers raise valid concerns with respect to the novelty and importance of this work and (2) that the paper is, indeed, borderline for ICLR. The paper is an application paper, in which the authors propose the firstÊend-to-end sentence level lip reading using deep learning. Positive aspects of the paper include:
 
 - A comprehensive and organized review about previous work.
 - Clear description of the model and experimental methods.
 - Careful reporting of the results, with attention to detail.
 - Proposed method appears to perform better than the prior state-of-the-art, and generalizes across speakers.
 
 However, the paper has several prominent negative aspects as well:
 
 - The GRID corpus that is used for experimentation has very substantial (known) limitations. In particular, it is constructed in a way that leads to a very limited (non-natural) set of sentences.Ê(For every word, there is an average of just 8.5 possible options the model has to choose from.)
 - The paper overstates some of its claims. In particular, the claim that the model is ""outperforming experienced human lipreaders"" is questionable: it is not unlikely that model achieves its performance by exploiting unrealistic statistical biases in the corpus that humans cannot / do not exploit. Similarly, the claims about the ""sentence-level"" nature of the model are not substantiated: it remains unclear what aspects of the model make this a sentence-level model, nor is there much empirical evidence that the sentence-level treatment of video data is helping much (the NoLM baseline is almost as good as LipNet, despite the strong biases in the GRID corpus).
 - The paper makes several other statements that are not well-founded. As one of the reviewers correctly remarks, the McGurk effect does not show that lipreading plays a crucial role in human communication (it merely shows that vision can influence speech recognition). Similarly, the claim that ""Bi-GRUs are crucial for efficient further aggregation"" is not supported by empirical evidence.
 
 A high-level downside of this paper is that, while studying a relevant application of deep learning, it presents no technical contributions or novel insights that have impact beyond the application studied in the paper."
353,SJJN38cge,Reject,Distributed Transfer Learning for Deep Convolutional Neural Networks by Basic Probability Assignment,"Transfer learning is a popular practice in deep neural networks, but fine-tuning of a large number of parameters is a hard challenge due to the complex wiring of neurons between splitting layers and imbalance class distributions of original and transferred domains. Recent advances in evidence theory show that in an imbalance multiclass learning problem, optimizing of proper objective functions based on contingency tables prevents biases towards high-prior classes. Transfer learning usually deals with highly non-convex objectives and local minima in deep neural architectures. We propose a novel distributed transfer learning to tackle both optimization complexity and class-imbalance problem jointly. Our solution imposes separated greedy regularization to each individual convolutional filter to make single-filter neural networks such that the minority classes perform as the majority ones. Then, basic probability assignment from evidence theory boosts these distributed networks to improve the recognition performance on the target domains. Our experiments on several standard datasets confirm the consistent improvement as a result of our distributed transfer learning strategy.","['Deep learning', 'Transfer Learning', 'Supervised Learning', 'Optimization']","All three reviewers appeared to have substantial difficulties understanding the proposed approach due to unclear presentation. This makes it hard for the reviewers to evaluate the originality and potential merits of the proposed approach, and to assess the quality of the empirical evaluation. I encourage the authors to improve the presentation of the study."
354,SkwSJ99ex,Reject,DeepRebirth: A General Approach for Accelerating Deep Neural Network Execution on Mobile Devices,"Deploying deep neural networks on mobile devices is a challenging task due to computation complexity and memory intensity. Existing works solve this problem by reducing model size using weight approximation methods based on dimension reduction (i.e., SVD, Tucker decomposition and Quantization). However, the execution speed of these compressed models are still far below the real-time processing requirement of mobile services. To address this limitation, we propose a novel acceleration framework: DeepRebirth by exploring the deep learning model parameter sparsity through merging the parameter-free layers with their neighbor convolution layers to a single dense layer. The design of DeepRebirth is motivated by the key observation: some layers (i.e., normalization and pooling) in deep learning models actually consume a large portion of computational time even few learned parameters are involved, and acceleration of these layers has the potential to improve the processing speed significantly. Essentially, the functionality of several merged layers is replaced by the new dense layer – rebirth layer in DeepRebirth. In order to preserve the same functionality, the rebirth layer model parameters are re-trained to be functionality equivalent to the original several merged layers. The extensive experiments performed on ImageNet using several popular mobile devices demonstrate that DeepRebirth is not only providing huge speed-up in model deployment and significant memory saving but also maintaining the model accuracy, i.e., 3x-5x speed-up and energy saving on GoogLeNet with only 0.4% accuracy drop on top-5 categorization in ImageNet. Further, by combining with other model compression techniques, DeepRebirth offers an average of 65ms model forwarding time on each image using Samsung Galaxy S6 with only 2.4% accuracy drop. In addition, 2.5x run-time memory saving is achieved with rebirth layers.",[],The proposed method doesn't have enough novelty to be accepted to ICLR.
355,HJ7O61Yxe,Reject,Modelling Relational Time Series using Gaussian Embeddings,"We address the problem of modeling multiple simultaneous time series where the observations are correlated not only inside each series, but among the different series. This problem happens in many domains such as ecology, meteorology, etc.  We propose a new dynamical state space model, based on representation learning, for modeling the evolution of such series. The joint relational and temporal dynamics of the series are modeled as Gaussian distributions in a latent space. A decoder maps the latent representations to the observations. The two components (dynamic model and decoder) are jointly trained. Using stochastic representations allows us to model the uncertainty inherent to observations and to predict unobserved values together with a confidence in the prediction.","['Applications', 'Deep learning']","The reviews of this paper seem to be very aligned: many of the ideas presented in the paper are interesting, the problem is important, and the results encouraging but preliminary. R2 thought the paper could be improved in terms of clarity and offered several specific suggestions to this end. R2 and R1 mentioned the limitations of the linear decoder; which is not a critical flaw, in my opinion, but as R1 points out, many recent works have explored nonlinear decoders and these could be at least discussed, if not compared. All of the reviewers have worked in this area and expressed high-confidence reviews.
 
 I was surprised that the authors did not provide feedback or revise the paper at least with reference to the clarity/presentation suggestions. It seems this may have had an impact on the perception of the reviewers. I encourage the authors to revise the paper in light of the reviews and re-submit to another venue."
356,ByZvfijeg,Reject,Higher Order Recurrent Neural Networks,"In this paper, we study novel neural network structures to better model long term dependency in sequential data. 
We propose to use more memory units to keep track of more preceding states in recurrent neural networks (RNNs), which are all recurrently fed to the hidden layers as feedback through different weighted paths. By extending the popular
recurrent structure in RNNs, we provide the models with better short-term memory mechanism to learn long term dependency in sequences. Analogous to digital filters in signal processing, we call these structures as higher order RNNs (HORNNs). Similar to RNNs, HORNNs can also be learned using the back-propagation through time method. HORNNs are generally applicable to a variety of sequence modelling tasks. In this work, we have examined HORNNs for the language modeling task using two popular data sets, namely the Penn Treebank (PTB) and English text8. Experimental results have shown that the proposed HORNNs yield the state-of-the-art performance on both data sets, significantly outperforming the regular RNNs as well as the popular LSTMs. ","['Deep learning', 'Natural language processing']","Paper presents the idea of using higher order recurrence in LSTMs. The ideas are well presented and easy to follow.
 However, the results are far from convincing, easily being below well established numbers in the domain. Since the mode is but a very simple extension of the baseline recurrent models using LSTMs that are state of the art on language modelling, it should have been easy to make a fair comparison by replacing the LSTMs of the state of the art models with higher order versions, but the authors did not do that. Their claimed numbers for SOTA are far from previously reported numbers in that setup, as pointed out by reviewers."
357,rJe-Pr9le,Reject,Multi-task learning with deep model based reinforcement learning,"In recent years, model-free methods that use deep learning have achieved great success in many different reinforcement learning environments. Most successful approaches focus on solving a single task, while multi-task reinforcement learning remains an open problem. In this paper, we present a model based approach to deep reinforcement learning which we use to solve different tasks simultaneously. We show that our approach not only does not degrade but actually benefits from learning multiple tasks. For our model, we also present a new kind of recurrent neural network inspired by residual networks that decouples memory from computation allowing to model complex environments that do not require lots of memory. The code will be released before ICLR 2017.","['Reinforcement Learning', 'Deep learning', 'Games', 'Transfer Learning']","The authors have proposed a new method for deep RL that uses model-based evaluation of states and actions and reward/life loss predictions. The evaluation, on just 3 ATari games with no comparisons to state of the art methods, is insufficient, and the method seems ad-hoc and unclear. Design choices are not clearly described or justified. The paper gives no insight as to how the different aspects of the approach relate or contribute to the overall results."
358,Bk0MRI5lg,Reject,Bridging Nonlinearities and Stochastic Regularizers with Gaussian Error Linear Units,"We propose the Gaussian Error Linear Unit (GELU), a high-performing neural network activation function. The GELU nonlinearity is the expected transformation of a stochastic regularizer which randomly applies the identity or zero map to a neuron's input. This stochastic regularizer is comparable to nonlinearities aided by dropout, but it removes the need for a traditional nonlinearity. The connection between the GELU and the stochastic regularizer suggests a new probabilistic understanding of nonlinearities. We perform an empirical evaluation of the GELU nonlinearity against the ReLU and ELU activations and find performance improvements across all tasks.",[],The reviewers unanimously recommend rejecting the paper.
359,r1y1aawlg,Reject,Iterative Refinement for Machine Translation,"Existing machine translation decoding algorithms generate translations in a strictly monotonic fashion and never revisit previous decisions. As a result, earlier mistakes cannot be corrected at a later stage. In this paper, we present a translation scheme that starts from an initial guess and then makes iterative improvements that may revisit previous decisions. We parameterize our model as a convolutional neural network that predicts discrete substitutions to an existing translation based on an attention mechanism over both the source sentence as well as the current translation output. By making less than one modification per sentence, we improve the output of a phrase-based translation system by up to 0.4 BLEU on WMT15 German-English translation.",['Natural language processing'],"The paper is an interesting first step, but the reviewers found flaws in the overall argument. Further, the method is not contextualized well enough in relation to prior work."
360,HyFkG45gl,Reject,Machine Solver for Physics Word Problems,"We build a machine solver for word problems on the physics of a free
falling object under constant acceleration of gravity.  Each problem
consists of a formulation part, describing the setting, and a question
part asking for the value of an unknown.  Our solver consists of
two long short-term memory recurrent neural networks and a numerical
integrator. The first neural network (the labeler) labels each
word of the problem, identifying the physical parameters and the
question part of the problem. The second neural network (the 
classifier) identifies what is being asked in the question. Using
the information extracted by both networks, the numerical integrator
computes the solution.  We observe that the classifier is resilient
to errors made by the labeler, which does a better job of identifying
the physics parameters than the question. Training, validation and test
sets of problems are generated from a grammar, with validation and test
problems structurally different from the training problems. The overall
accuracy of the solver on the test cases is 99.8%.",[],"The paper explores a model for solving simple physics problems (posed in automatically generated natural language). Whilst this an interesting problem, the reviewers worry that the problem is too simple because all problems are automatically generated. The paper should at least incorporate some reasonable baseline models and/or apply the proposed methodology on real physics problems."
361,S1JG13oee,Reject,b-GAN: Unified Framework of Generative Adversarial Networks,"Generative adversarial networks (GANs) are successful deep generative models. They are based on a two-player minimax game. However, the objective function derived in the original motivation is changed to obtain stronger gradients when learning the generator. We propose a novel algorithm that repeats density ratio estimation and f-divergence minimization. Our algorithm offers a new unified perspective toward understanding GANs and is able to make use of multiple viewpoints obtained from the density ratio estimation research, e.g. what divergence is stable and relative density ratio is useful. ","['Deep learning', 'Unsupervised Learning']","The paper may have an interesting contribution, but at present its motivation, and the presentation in general, are not clear enough. After a re-write, the paper might become quite interesting and should be submitted to some other forum."
362,S19eAF9ee,Reject,Structured Sequence Modeling with Graph Convolutional Recurrent Networks,"This paper introduces Graph Convolutional Recurrent Network (GCRN), a deep learning model able to predict structured sequences of data. Precisely, GCRN is a generalization of classical recurrent neural networks (RNN) to data structured by any arbitrary graph. Such structured sequences can be series of frames in videos, spatio-temporal measurements on a network of sensors, or random walks on a vocabulary graph for natural language modeling.The proposed model combines convolutional neural networks (CNN) on graphs to identify spatial structures and RNN to find dynamic patterns. We study two possible architectures of GCRN, and apply the models to two practical problems: predicting moving MNIST data, and modeling natural language with the Penn Treebank dataset. Experiments show that exploiting simultaneously graph spatial and dynamic information about data can improve both precision and learning speed.",['Structured prediction'],"While graph structures are an interesting problem, as the reviewers observed, the paper extends previous work incrementally and the results are not very moving.
 
 pros
 - interesting problem space that has not been thoroughly explored
 cons
 - experimental evaluation was not convincing enough with the results.
 - the method itself is a small incremental improvement over prior papers."
363,B1ZXuTolx,Reject,Revisiting Denoising Auto-Encoders,"Denoising auto-encoders (DAE)s were proposed as a simple yet powerful way to obtain representations in an unsupervised manner by learning a map that approximates the clean inputs from their corrupted versions. However, the original objective function proposed for DAEs does not guarantee that denoising happens only at the encoding stages. We argue that a better representation can be obtained if the encoder is forced to carry out most of the denoising effort. Here, we propose a simple modification to the DAE's objective function that accomplishes the above goal. ",[],"The proposed modification of the denoising autoencoder objective is interesting. Shifting some of the burden to the encoder has potential, but the authors need to to show that this burden cannot be transferred to the decoder; they propose some ways of doing this in their response, but these should be explored. And more convincing, larger-scale results are needed."
364,HyAddcLge,Reject,Revisiting Distributed Synchronous SGD,"Distributed training of deep learning models on large-scale training data is typically conducted with asynchronous stochastic optimization to maximize the rate of updates, at the cost of additional noise introduced from asynchrony. In contrast, the synchronous approach is often thought to be impractical due to idle time wasted on waiting for straggling workers. We revisit these conventional beliefs in this paper, and examine the weaknesses of both approaches. We demonstrate that a third approach, synchronous optimization with backup workers, can avoid asynchronous noise while mitigating for the worst stragglers. Our approach is empirically validated and shown to converge faster and to better test accuracies.
","['Optimization', 'Deep learning', 'Applications']","Counter to the current wisdom, this work proposes that synchronous training may be advantageous over asynchronous training (provided that ""backup workers"" are available). This is shown empirical and without theoretical results. The contribution is somewhat straightforward and designed for a specific large-scale hardware scenario, but this is often an important bottleneck in the learning process. However, there is some concern about the long-term impact of this work, due to its dependence on the hardware."
