,PaperID,Decision,Title,Abstract,Keyword,Comment
0,HJWHIKqgl,Accept (Poster),Generative Models and Model Criticism via Optimized Maximum Mean Discrepancy,"We propose a method to optimize the representation and distinguishability of samples from two probability distributions, by maximizing the estimated power of a statistical test based on the maximum mean discrepancy (MMD). This optimized MMD is applied to the setting of unsupervised learning by generative adversarial networks (GAN), in which a model attempts to generate realistic samples, and a discriminator attempts to tell these apart from data samples. In this context, the MMD may be used in two roles: first, as a discriminator, either directly on the samples, or on features of the samples. Second, the MMD can be used to evaluate the performance of a generative model, by testing the model’s samples against a reference data set. In the latter role, the optimized MMD is particularly helpful, as it gives an interpretable indication of how the model and data distributions differ, even in cases where individual model samples are not easily distinguished either by eye or by classifier.",['Unsupervised Learning'],"This paper presents two ways that MMDs can be used to aid the GAN training framework. The relation to current literature is clearly explained, and the paper has illuminating side-experiments. The main con is that it's not clear if MMD-based training will be competitive in the long run with more flexible, but harder-to-use, neural network based approaches. However, this paper gives us a conceptual framework to evaluate new proposals for related GAN training procedures."
1,SyK00v5xx,Accept (Poster),A Simple but Tough-to-Beat Baseline for Sentence Embeddings,"
The success of neural network methods for computing word embeddings has motivated methods for generating semantic embeddings of longer pieces of text, such as sentences and paragraphs. Surprisingly, Wieting et al (ICLR'16) showed that such complicated methods are outperformed, especially in out-of-domain (transfer learning) settings, by simpler methods involving mild retraining of word embeddings and basic linear regression. The  method of Wieting et al. requires retraining with a substantial labeled dataset such as Paraphrase Database (Ganitkevitch et al., 2013). 

The current paper goes further, showing that the following completely unsupervised sentence embedding is a formidable baseline: Use word embeddings computed using one of the popular methods on unlabeled corpus like Wikipedia, represent the sentence by a weighted average of the word vectors, and then modify them a bit using PCA/SVD. This weighting improves performance by about 10% to 30% in textual similarity tasks, and beats sophisticated supervised methods including RNN's and LSTM's. It even improves Wieting et al.'s embeddings. 
 This simple method should be used as the baseline to beat in future, especially when labeled training data is scarce or nonexistent. 

The paper also gives a theoretical explanation of the success of the above unsupervised method using a latent variable generative model for sentences, which is a simple extension of the model in Arora et al. (TACL'16) with new ""smoothing"" terms that allow for 
words occurring out of context, as well as high probabilities for words like and, not in all contexts. ","['Natural language processing', 'Unsupervised Learning']",A new method for sentence embedding that is simple and performs well. Important contribution that will attract attention and help move the field forward.
2,Hkg4TI9xl,Accept (Poster),A Baseline for Detecting Misclassified and Out-of-Distribution Examples in Neural Networks,"We consider the two related problems of detecting if an example is misclassified or out-of-distribution. We present a simple baseline that utilizes probabilities from softmax distributions. Correctly classified examples tend to have greater maximum softmax probabilities than erroneously classified and out-of-distribution examples, allowing for their detection. We assess performance by defining several tasks in computer vision, natural language processing, and automatic speech recognition, showing the effectiveness of this baseline across all. We then show the baseline can sometimes be surpassed, demonstrating the room for future research on these underexplored detection tasks.",['Computer vision'],"The paper presents an approach that uses the statistics of softmax outputs to identify misclassifications and/or outliers. The reviewers had mostly minor comments on the paper, which appear to have been appropriately addressed in the revised version of the paper."
3,Hk1iOLcle,Reject,MS MARCO: A Human-Generated MAchine Reading COmprehension Dataset,"This paper presents our recent work on the design and development of a new, large scale dataset, which we name MS MARCO, for MAchine Reading COmprehension. This new dataset is aimed to overcome a number of well-known weaknesses of previous publicly available datasets for the same task of reading comprehension and question answering. In MS MARCO, all questions are sampled from real anonymized user queries. The context passages, from which answers in the dataset are derived, are extracted from real web documents using the most advanced version of the Bing search engine. The answers to the queries are human generated. Finally, a subset of these queries has multiple answers. We aim to release one million queries and the corresponding answers in the dataset, which, to the best of our knowledge, is the most comprehensive real-world dataset of its kind in both quantity and quality. We are currently releasing 100,000 queries with their corresponding answers to inspire work in reading comprehension and question answering along with gathering feedback from the research community.",[],"Though the dataset is likely to have a large impact on the community, there is a general consensus among the reviewers that the authors could have done a better job characterizing the dataset (lack discussion on answer types, careful comparison with previous datasets, human performance on the dataset). So sadly, though the dataset is potentially very important, the paper does not quite cut it.
 
 Positive:
 -- an important dataset
 -- a good job with establishing baselines
 
 Negative
 -- analysis and discussions are very limited"
4,H178hw9ex,Reject,Dynamic Steerable Frame Networks,"Filters in a convolutional network are typically parametrized in a pixel basis. As an orthonormal basis, pixels may represent any arbitrary vector in Rn. In this paper, we relax this orthonormality requirement and extend the set of viable bases to the generalized notion of frames. When applying suitable frame bases to ResNets on Cifar-10+ we demonstrate improved error rates by substitution only. By exploiting the transformation properties of such generalized bases, we arrive at steerable frames, that allow to continuously transform CNN filters under arbitrary Lie-groups. Further allowing us to locally separate pose from canonical appearance. We implement this in the Dynamic Steerable Frame Network, that dynamically estimates the transformations of filters, conditioned on its input. The derived method presents a hybrid of Dynamic Filter Networks and Spatial Transformer Networks that can be implemented in any convolutional architecture, as we illustrate in two examples. First, we illustrate estimation properties of steerable frames with a Dynamic Steerable Frame Network, compared to a Dynamic Filter Network on the task of edge detection, where we show clear advantages of the derived steerable frames. Lastly, we insert the Dynamic Steerable Frame Network as a module in a convolutional LSTM on the task of limited-data hand-gesture recognition from video and illustrate effective dynamic regularization and show clear advantages over Spatial Transformer Networks. In this paper, we have laid out the foundations of Frame-based convolutional networks and Dynamic Steerable Frame Networks while illustrating their advantages for continuously transforming features and data-efficient learning.","['Computer vision', 'Deep learning']","This paper studies how to incorporate local invariance to geometric transformations into a CNN pipeline. It proposes steerable filter banks as the ground-bed to measure and produce such local invariance, building on previous work from the same authors as well as the Spatial Transformer Networks. Preliminary experiments on several tasks requiring different levels of local invariance are presented. 
 
 The reviewers had varying opinions about this work; all acknowledged the potential benefits of the approach, while some of them raised questions about the significance and usefulness of the approach. The authors were very responsive during the rebuttal phase and took into account all the feedback. 
 
 Based on the technical content of the paper and the reviewers opinion, the AC recommends rejection. Since this decision is not consensual among all reviewers, please let me explain it in more detail.
 
 - The current manuscript does not provide a clear description of the new model in the context of the related works it builds upon (the so-called dynamic filter networks and the spatial transformer networks). The paper spends almost 4 pages with a technical exposition on steerable frames, covering basic material from signal processing. While this might indeed be a good introduction to readers not familiar with the concept of steerable filters, the fact is that it obfuscates the real contributions of the paper. which are not clearly stated. In fact, the model is presented between equations (10) and (11), but it is not clear from these equations what specifically differentiates the dsfn from the other two models -- the reader has to do some digging in order to uncover the differences (which are important). 
 
 Besides this clarity issue, the paper does not offer any insight as to how the 'Pose generating network' Psi is supposed to estimate the pose parameters. Which architecture? what is the underlying estimation problem it is trying to solve, and why do we expect this problem to be efficiently estimated with a neural network? when are the pose parameters uniquely determined? how does this network deal with the aperture effects (i.e. the situations where there is no unicity in determining a specific pose) ?
 Currently, the reader has no access to these questions, which are to some extent at the core of the proposed technique."
5,S1TER2oll,Accept (Poster),FILTER SHAPING FOR CONVOLUTIONAL NEURAL NETWORKS,"Convolutional neural networks (CNNs) are powerful tools for classification of visual inputs. An important property of CNN is its restriction to local connections and sharing of local weights among different locations. In this paper, we consider the definition of appropriate local neighborhoods in CNN. We provide a theoretical analysis that justifies the traditional square filter used in CNN for analyzing natural images. The analysis also provides a principle for designing customized filter shapes for application domains that do not resemble natural images. We propose an approach that automatically designs multiple layers of different customized filter shapes by repeatedly solving lasso problems. It is applied to customize the filter shape for both bioacoustic applications and gene sequence analysis applications. In those domains with small sample sizes we demonstrate that the customized filters achieve superior classification accuracy, improved convergence behavior in training and reduced sensitivity to hyperparameters.",[],"Using covariance analysis for designing convolution connection structure is a nice and novel idea. All three reviewers recommended acceptance. Since the reviewers were not confident about the theoretical derivations, the AC asked for an opinion from an additional reviewer. This reviewer also found the paper interesting and novel, and recommended acceptance."
6,SywUHFcge,Invite to Workshop Track, A Theoretical Framework for Robustness of (Deep) Classifiers against Adversarial Samples,"Most machine learning classifiers, including deep neural networks, are vulnerable to adversarial examples. Such inputs are typically generated by adding small but purposeful modifications that lead to incorrect outputs while imperceptible to human eyes. The goal of this paper is not to introduce a single method, but to make theoretical steps toward fully understanding adversarial examples. By using concepts from topology, our theoretical analysis brings forth the key reasons why an adversarial example can fool a classifier ($f_1$) and adds its oracle ($f_2$, like human eyes) in such analysis. 
By investigating the topological relationship between two (pseudo)metric spaces corresponding to predictor $f_1$ and oracle $f_2$, we develop necessary and sufficient conditions that can determine if $f_1$ is always robust (strong-robust) against adversarial examples according to $f_2$. Interestingly our theorems indicate that just one unnecessary feature can make $f_1$ not strong-robust, and the right feature representation learning is the key to getting a classifier that is both accurate and strong robust.
",['Deep learning'],"The authors propose a framework to analyze ""robustness"" to adversarial perturbations using topological concepts. The authors conduct an empirical study using a siamese networks. 
 
 The paper generated extensive discussions. The authors implemented many changes following the reviewers' suggestions. The resulting version of the paper is rather dense. It is unclear whether a conference is appropriate for reviewing such material in limited time. 
 
 We invite the authors to present their main results in the workshop track. Revising the material of the paper will generate a stronger submission to a future venue such as a journal."
7,B1Igu2ogg,Accept (Poster),Efficient Vector Representation for Documents through Corruption,"We present an efficient document representation learning framework, Document Vector through Corruption (Doc2VecC). Doc2VecC represents each document as a simple average of word embeddings. It ensures a representation generated as such captures the semantic meanings of the document during learning. A corruption model is included, which introduces a data-dependent regularization that favors informative or rare words while forcing the embeddings of common and non-discriminative ones to be close to zero. Doc2VecC produces significantly better word embeddings than Word2Vec. We compare Doc2VecC with several state-of-the-art document representation learning algorithms. The simple model architecture introduced by Doc2VecC matches or out-performs the state-of-the-art in generating high-quality document representations for sentiment analysis, document classification as well as semantic relatedness tasks. The simplicity of the model enables training on billions of words per hour on a single machine. At the same time, the model is very efficient in generating representations of unseen documents at test time.
","['Natural language processing', 'Deep learning', 'Semi-Supervised Learning']","The introduced method for producing document representations is simple, efficient and potentially quite useful. Though we could quibble a bit that the idea is just a combination of known techniques, the reviews generally agree that the idea is interesting.
 
 Pros:
 + interesting and simple algorithm
 + strong performance
 + efficient
 
 Cons:
 + individual ideas are not so novel
 
 This is a paper that will be well received at a poster presentation."
8,r1X3g2_xl,Accept (Poster),Adversarial Training Methods for Semi-Supervised Text Classification,"Adversarial training provides a means of regularizing supervised learning algorithms while virtual adversarial training is able to extend supervised learning algorithms to the semi-supervised setting.
However, both methods require making small perturbations to numerous entries of the input vector, which is inappropriate for sparse high-dimensional inputs such as one-hot word representations.
We extend adversarial and virtual adversarial training to the text domain by applying perturbations to the word embeddings in a recurrent neural network rather than to the original input itself.
The proposed method achieves state of the art results on multiple benchmark semi-supervised and purely supervised tasks.
We provide visualizations and analysis showing that the learned word embeddings have improved in quality and that while training, the model is less prone to overfitting.
","['Natural language processing', 'Deep learning', 'Semi-Supervised Learning']","This paper is concerned with extending adversarial and virtual adversarial training to text classification tasks. The main technical contribution is to apply perturbations to word embeddings rather than discrete input symbols. Excellent empirical performance is reported across a variety of tasks. 
 
 The reviewers were consensual in acknowledging the clarity and significance of the contribution, highlighting the quality of the numerical experiments. Moreover, the authors were responsive in the rebuttal phase and updated their paper with reviewers suggestions (such as the svm-related comparisons). 
 
 The AC thus recommends accepting this work as a poster."
9,r1Ue8Hcxg,Accept (Oral),Neural Architecture Search with Reinforcement Learning,"Neural networks are powerful and flexible models that work well for many difficult learning tasks in image, speech and natural language understanding. Despite their success, neural networks are still hard to design. In this paper, we use a recurrent network to generate the model descriptions of neural networks and train this RNN with reinforcement learning to maximize the expected accuracy of the generated architectures on a validation set. On the CIFAR-10 dataset, our method, starting from scratch, can design a novel network architecture that rivals the best human-invented architecture in terms of test set accuracy. Our CIFAR-10 model achieves a test error rate of 3.65, which is 0.09 percent better and 1.05x faster than the previous state-of-the-art model that used a similar architectural scheme. On the Penn Treebank dataset, our model can compose a novel recurrent cell that outperforms the widely-used LSTM cell, and other state-of-the-art baselines.  Our cell achieves a test set perplexity of 62.4 on the Penn Treebank, which is 3.6 perplexity better than the previous state-of-the-art model. The cell can also be transferred to the character language modeling task on PTB and achieves a state-of-the-art perplexity of 1.214.",[],"This was one of the most highly rated papers submitted to the conference. The reviewers all enjoyed the idea and found the experiments rigorous, interesting and compelling. Especially interesting was the empirical result that the model found architectures that outperform those that are used extensively in the literature (i.e. LSTMs)."
10,rkEFLFqee,Accept (Poster),Decomposing Motion and Content for Natural Video Sequence Prediction,"We propose a deep neural network for the prediction of future frames in natural video sequences. To effectively handle complex evolution of pixels in videos, we propose to decompose the motion and content, two key components generating dynamics in videos. Our model is built upon the Encoder-Decoder Convolutional Neural Network and Convolutional LSTM for pixel-level prediction, which independently capture the spatial layout of an image and the corresponding temporal dynamics. By independently modeling motion and content, predicting the next frame reduces to converting the extracted content features into the next frame content by the identified motion features, which simplifies the task of prediction. Our model is end-to-end trainable over multiple time steps, and naturally learns to decompose motion and content without separate training. We evaluate the pro- posed network architecture on human activity videos using KTH, Weizmann action, and UCF-101 datasets. We show state-of-the-art performance in comparison to recent approaches. To the best of our knowledge, this is the first end-to-end trainable network architecture with motion and content separation to model the spatio-temporal dynamics for pixel-level future prediction in natural videos.","['Computer vision', 'Deep learning', 'Unsupervised Learning']","Here is a summary of the reviews and discussion:
 
 Strengths
 Idea of decoupling motion and content is interesting in the context of future frame prediction (R3, R2, R1)
 Quantitative and Qualitative results are good (R1)
 
 Weaknesses
 Novelty in light of previous multi-stream networks (R3, R2)
 Not clear if this kind of decoupling works well or is of broader interest beyond future frame prediction (R3) AC comment: I donÕt know if this is too serious a concern; to me the problem seems important enough -- making an advancement that improves a single relevant problem is a contribution
 Separation of motion and content already prevalent in other applications, e.g., pose estimation (R2)
 UCF-101 results are not so convincing (R3)
 Clarity could be improved, not written with general audience in mind (R2)
 Concern about static bias in the UCF dataset of the learned representations (R1, R2, R3) AC comment: The authors ran significant additional experiments to respond to this point
 
 The authors provided a comprehensive rebuttal which convinced R1 to upgrade their score. After engaging R2 and R3 in discussion, both said that the paper had improved in its subsequent revisions and would be happy to see the paper pass. The AC agrees with the opinion of the reviewers that the paper should be accepted as a poster."
11,H1acq85gx,Accept (Poster),Maximum Entropy Flow Networks,"Maximum entropy modeling is a flexible and popular framework for formulating statistical models given partial knowledge. In this paper, rather than the traditional method of optimizing over the continuous density directly, we learn a smooth and invertible transformation that maps a simple distribution to the desired maximum entropy distribution. Doing so is nontrivial in that the objective being maximized (entropy) is a function of the density itself.  By exploiting recent developments in normalizing flow networks, we cast the maximum entropy problem into a finite-dimensional constrained optimization, and solve the problem by combining stochastic optimization with the augmented Lagrangian method. Simulation results demonstrate the effectiveness of our method, and applications to finance and computer vision show the flexibility and accuracy of using maximum entropy flow networks.",[],"This paper is an interesting application to maximum entropy problems, which are not widely considered in deep learning. The reviewers have concerns over the novelty of this method and the ultimate applicability and scope of these methods. But this method should be of interest, especially in connecting deep learning to the wider community on information theory and should make an interesting contribution to this year's proceedings."
12,Sy2fzU9gl,Accept (Poster),beta-VAE: Learning Basic Visual Concepts with a Constrained Variational Framework,"Learning an interpretable factorised representation of the independent data generative factors of the world without supervision is an important precursor for the development of artificial intelligence that is able to learn and reason in the same way that humans do. We introduce beta-VAE, a new state-of-the-art framework for automated discovery of interpretable factorised latent representations from raw image data in a completely unsupervised manner. Our approach is a modification of the variational autoencoder (VAE) framework. We introduce an adjustable hyperparameter beta that balances latent channel capacity and independence constraints with reconstruction accuracy. We demonstrate that beta-VAE with appropriately tuned beta > 1 qualitatively outperforms VAE (beta = 1), as well as state of the art unsupervised (InfoGAN) and semi-supervised (DC-IGN) approaches to disentangled factor learning on a variety of datasets (celebA, faces and chairs). Furthermore, we devise a protocol to quantitatively compare the degree of disentanglement learnt by different models, and show that our approach also significantly outperforms all baselines quantitatively. Unlike InfoGAN, beta-VAE is stable to train, makes few assumptions about the data and relies on tuning a single hyperparameter, which can be directly optimised through a hyper parameter search using weakly labelled data or through heuristic visual inspection for purely unsupervised data.",[],"This paper proposes a modification of the variational ELBO in encourage 'disentangled' representations, and proposes a measure of disentanglement. The main idea and is presented clearly enough and explored through experiments. This whole area still seems a little bit conceptually confused, but by proposing concrete metrics and methods, this paper makes several original contributions."
