,PaperID,Decision,Title,Abstract,Keyword,Comment
124,r1LXit5ee,Accept (Poster),Episodic Exploration for Deep Deterministic Policies for StarCraft Micromanagement,"We consider scenarios from the real-time strategy game StarCraft as benchmarks for reinforcement learning algorithms. We focus on micromanagement, that is, the short-term, low-level control of team members during a battle. We propose several scenarios that are challenging for reinforcement learning algorithms because the state- action space is very large, and there is no obvious feature representation for the value functions. We describe our approach to tackle the micromanagement scenarios with deep neural network controllers from raw state features given by the game engine. We also present a heuristic reinforcement learning algorithm which combines direct exploration in the policy space and backpropagation. This algorithm collects traces for learning using deterministic policies, which appears much more efficient than, e.g., ε-greedy exploration. Experiments show that this algorithm allows to successfully learn non-trivial strategies for scenarios with armies of up to 15 agents, where both Q-learning and REINFORCE struggle.","['Deep learning', 'Reinforcement Learning', 'Games']","The paper presents an approach to structured exploration in StarCraft micromanagement policies (essentially small tasks in the game). From an application standpoint, this is a notable advance, since the authors are tackling a challenging domain and in doing so develop a novel exploration algorithm that seems to work quite well here.
 
 The main downside of the paper is that the proposed algorithm does seem fairly ad-hoc: certain approximations in the algorithm, like ignoring the argmax term in computing the backprop, are not really justified except in that it ""seems to work well in practice"" (a quote from the paper), so it's really unclear whether these represent general techniques or just a method that happens to work well on the target domain for poorly understood reasons.
 
 Despite this, however, I think the strength of the application is sufficient here. Deep learning has been alternatively pushed forward by more algorithmic/mathematical advances and more applied advances, with many of the major breakthroughs coming from seemingly ad-hoc strategies applied to challenging problems. This paper falls in that later category: the ZO algorithm may or may not lead to something slightly more disciplined in the future, but for now the compelling results on StarCraft are I believe enough to warrant accepting the paper.
 
 Pros:
 + Substantial performance improvement (over basic techniques like Q-learning) on a challenging task
 + Nice intuitive justification of a new exploration approach
 
 Cons:
 - Proposed algorithm seems rather ad-hoc, making some (admittedly not theoretically justified) approximations simply because they seem to work well in practice"
125,rJiNwv9gg,Accept (Poster),Lossy Image Compression with Compressive Autoencoders,"We propose a new approach to the problem of optimizing autoencoders for lossy image compression. New media formats, changing hardware technology, as well as diverse requirements and content types create a need for compression algorithms which are more flexible than existing codecs. Autoencoders have the potential to address this need, but are difficult to optimize directly due to the inherent non-differentiabilty of the compression loss. We here show that minimal changes to the loss are sufficient to train deep autoencoders competitive with JPEG 2000 and outperforming recently proposed approaches based on RNNs. Our network is furthermore computationally efficient thanks to a sub-pixel architecture, which makes it suitable for high-resolution images. This is in contrast to previous work on autoencoders for compression using coarser approximations, shallower architectures, computationally expensive methods, or focusing on small images.","['Computer vision', 'Deep learning', 'Applications']","This paper optimizes autoencoders for lossy image compression. Minimal adaptation of the loss makes autoencoders competitive with JPEG2000 and computationally efficient, while the generalizability of trainable autoencoders offers the added promise of adaptation to new domains without domain knowledge.
 The paper is very clear and the authors have tried to give additional results to facilitate replication. The results are impressive. While another ICLR submission that is in the same space does outperform JPEG2000, this contributions nevertheless also offers state-of-the-art performance and should be of interest to many ICLR attendees."
126,BJ6oOfqge,Accept (Poster),Temporal Ensembling for Semi-Supervised Learning,"In this paper, we present a simple and efficient method for training deep neural networks in a semi-supervised setting where only a small portion of training data is labeled. We introduce self-ensembling, where we form a consensus prediction of the unknown labels using the outputs of the network-in-training on different epochs, and most importantly, under different regularization and input augmentation conditions. This ensemble prediction can be expected to be a better predictor for the unknown labels than the output of the network at the most recent training epoch, and can thus be used as a target for training. Using our method, we set new records for two standard semi-supervised learning benchmarks, reducing the (non-augmented) classification error rate from 18.44% to 7.05% in SVHN with 500 labels and from 18.63% to 16.55% in CIFAR-10 with 4000 labels, and further to 5.12% and 12.16% by enabling the standard augmentations. We additionally obtain a clear improvement in CIFAR-100 classification accuracy by using random images from the Tiny Images dataset as unlabeled extra inputs during training. Finally, we demonstrate good tolerance to incorrect labels.
",[],"The reviewers all agree that this is a strong, well-written paper that should be accepted to the conference. The reviewers would like to see the authors extend the analysis to larger data sets and extend the variety of augmentations. Two of the reviewers seem to suggest that some of the experiments seem too good to be true. Please consider releasing code so that others can reproduce experiments and build on this in future work."
127,rJY0-Kcll,Accept (Oral),Optimization as a Model for Few-Shot Learning,"Though deep neural networks have shown great success in the large data domain, they generally perform poorly on few-shot learning tasks, where a model has to quickly generalize after seeing very few examples from each class. The general belief is that gradient-based optimization in high capacity models requires many iterative steps over many examples to perform well. Here, we propose an LSTM-based meta-learner model to learn the exact optimization algorithm used to train another learner neural network in the few-shot regime. The parametrization of our model allows it to learn appropriate parameter updates specifically for the scenario where a set amount of updates will be made, while also learning a general initialization of the learner network that allows for quick convergence of training. We demonstrate that this meta-learning model is competitive with deep metric-learning techniques for few-shot learning. ",[],"The authors propose a meta-learner to address the problem of few-shot learning. The algorithm is interesting, and results are convincing. It's a very timely paper that will receive attention in the community. All three reviewers recommend an accept, with two being particularly enthusiastic. The authors also addressed some issues raised by the more negative reviewer. The AC also agrees that the writing needs a little more work to improve clarity. Overall, this is a clear accept."
128,HJDBUF5le,Accept (Poster),Towards a Neural Statistician,"An efficient learner is one who reuses what they already know to tackle a new problem. For a machine learner, this means understanding the similarities amongst datasets. In order to do this, one must take seriously the idea of working with datasets, rather than datapoints, as the key objects to model. Towards this goal, we demonstrate an extension of a variational autoencoder that can learn a method for computing representations, or statistics, of datasets in an unsupervised fashion. The network is trained to produce statistics that encapsulate a generative model for each dataset. Hence the network enables efficient learning from new datasets for both unsupervised and supervised tasks. We show that we are able to learn statistics that can be used for: clustering datasets, transferring generative models to new datasets, selecting representative samples of datasets and classifying previously unseen classes. We refer to our model as a neural statistician, and by this we mean a neural network that can learn to compute summary statistics of datasets without supervision.",[],This is an interesting paper that adds nicely to the literature on VAEs and one-shot generalisation. This will be of interest to the community and will contribute positively to the conference.
129,rJPcZ3txx,Accept (Poster),Faster CNNs with Direct Sparse Convolutions and Guided Pruning,"Phenomenally successful in practical inference problems, convolutional neural networks (CNN) are widely deployed in mobile devices, data centers, and even supercomputers.
The number of parameters needed in CNNs, however, are often large and undesirable. Consequently, various methods have been developed to prune a CNN once it is trained. 
Nevertheless, the resulting CNNs offer limited benefits. While pruning the fully connected layers reduces a CNN's size considerably, it does not improve inference speed noticeably as the compute heavy parts lie in convolutions. Pruning CNNs in a way that increase inference speed often imposes specific sparsity structures, thus limiting the achievable sparsity levels.

We present a method to realize simultaneously size economy and speed improvement while pruning CNNs. Paramount to our success is an efficient general sparse-with-dense matrix
multiplication implementation that is applicable to convolution of feature maps with kernels of arbitrary sparsity patterns. Complementing this, we developed a performance model that predicts sweet spots of sparsity levels for different layers and on different computer architectures. Together, these two allow us to demonstrate 3.1-7.3x convolution speedups over dense convolution in AlexNet, on Intel Atom, Xeon, and Xeon Phi processors, spanning the spectrum from mobile devices to supercomputers.
","['Deep learning', 'Optimization']","While the core ideas explored in this paper are quite limited in algorithmic novelty (e.g., the direct sparse convolutions), the reviewers largely feel that the paper is well written, experiments are carefully done on multiple architectures and system issues are discussed in-depth. Given the interest in the ICLR community around performance characterization and acceleration of CNNs in particular, this paper offers an interesting perspective."
130,HyY4Owjll,Reject,Boosted Generative Models,"We propose a new approach for using boosting to create an ensemble of generative models, where models are trained in sequence to correct earlier mistakes. Our algorithm can leverage  many existing base learners, including recent latent variable models. Further, our approach allows the ensemble to leverage discriminative models trained to distinguish real data from model generated data. We show theoretical conditions under which incorporating a new model to the ensemble will improve the fit and empirically demonstrate the effectiveness of boosting on density estimation and sample generation on real and synthetic datasets.","['Theory', 'Deep learning', 'Unsupervised Learning']","The idea of boosting has recently seen a revival, and the ideas presented here are stimulating. After discussion, the reviewers agreed that the latest updates and clarifications have improved the paper, but overall they still felt that the paper is not quite ready, especially in making the case for when taking this approach is desirable, which was the common thread of concern for everyone. For this reason, this paper is not yet ready for acceptance at this year's conference."
131,B1ewdt9xe,Accept (Poster),Deep Predictive Coding Networks for Video Prediction and Unsupervised Learning,"While great strides have been made in using deep learning algorithms to solve supervised learning tasks, the problem of unsupervised learning - leveraging unlabeled examples to learn about the structure of a domain - remains a difficult unsolved challenge. Here, we explore prediction of future frames in a video sequence as an unsupervised learning rule for learning about the structure of the visual world. We describe a predictive neural network (""PredNet"") architecture that is inspired by the concept of ""predictive coding"" from the neuroscience literature. These networks learn to predict future frames in a video sequence, with each layer in the network making local predictions and only forwarding deviations from those predictions to subsequent network layers. We show that these networks are able to robustly learn to predict the movement of synthetic (rendered) objects, and that in doing so, the networks learn  internal representations that are useful for decoding latent object parameters (e.g. pose) that support object recognition with fewer training views. We also show that these networks can scale to complex natural image streams (car-mounted camera videos), capturing key aspects of both egocentric movement and the movement of objects in the visual scene, and the representation learned in this setting is useful for estimating the steering angle. These results suggest that prediction represents a powerful framework for unsupervised learning, allowing for implicit learning of object and scene structure.",[],"This paper proposes an interesting architecture for predicting future frames of videos using end-to-end trained deep predictive coding.
  The architecture is well presented and the paper is clearly written. The experiments are extensive and convincing, include ablation analyses, and show that this architecture performs well compared to other current methods.
 Overall, this is an interesting, solid contribution."
132,B1ckMDqlg,Accept (Poster), Outrageously Large Neural Networks: The Sparsely-Gated Mixture-of-Experts Layer,"The capacity of a neural network to absorb information is limited by its number of parameters.  Conditional computation, where parts of the network are active on a per-example basis, has been proposed in theory as a way of dramatically increasing model capacity without a proportional increase in computation.  In practice, however, there are significant algorithmic and performance challenges.  In this work, we address these challenges and finally realize the promise of conditional computation, achieving greater than 1000x improvements in model capacity with only minor losses in computational efficiency on modern GPU clusters.  We introduce a Sparsely-Gated Mixture-of-Experts layer (MoE), consisting of up to thousands of feed-forward sub-networks.  A trainable gating network determines a sparse combination of these experts to use for each example.  We apply the MoE to the tasks of language modeling and machine translation, where model capacity is critical for absorbing the vast quantities of knowledge available in the training corpora.  We present model architectures in which a MoE with up to 137 billion parameters is applied convolutionally between stacked LSTM layers.  On large language modeling and machine translation benchmarks, these models achieve significantly better results than state-of-the-art at lower computational cost.",['Deep learning'],"The paper uses mixtures of experts to increase the capacity of deep networks, and describes the implementation of such a model on a cluster of GPUs. The proposed mixture model achieves strong performances in language modeling and machine translation."
133,SJ3rcZcxl,Accept (Oral),Q-Prop: Sample-Efficient Policy Gradient with An Off-Policy Critic,"Model-free deep reinforcement learning (RL) methods have been successful in a wide variety of simulated domains. However, a major obstacle facing deep RL in the real world is their high sample complexity. Batch policy gradient methods offer stable learning, but at the cost of high variance, which often requires large batches. TD-style methods, such as off-policy actor-critic and Q-learning, are more sample-efficient but biased, and often require costly hyperparameter sweeps to stabilize. In this work, we aim to develop methods that combine the stability of policy gradients with the efficiency of off-policy RL. We present Q-Prop, a policy gradient method that uses a Taylor expansion of the off-policy critic as a control variate. Q-Prop is both sample efficient and stable, and effectively combines the benefits of on-policy and off-policy methods. We analyze the connection between Q-Prop and existing model-free algorithms, and use control variate theory to derive two variants of Q-Prop with conservative and aggressive adaptation. We show that conservative Q-Prop provides substantial gains in sample efficiency over trust region policy optimization (TRPO) with generalized advantage estimation (GAE), and improves stability over deep deterministic policy gradient (DDPG), the state-of-the-art on-policy and off-policy methods, on OpenAI Gym's MuJoCo continuous control environments.","['Deep learning', 'Reinforcement Learning']","This paper presents a nice contribution to the RL literature, finding an intermediate point between the high-variance (but unbiased) gradient estimates from policy optimization methods, and low(er)-variance (but biased) gradient estimates from off-policy actor-critic methods like DDPG. The basic idea (as I'm interpreting it, similar to one of the reviewers below), that that we can use an action-dependent baseline, based upon off-policy learning, to lower the variance of the gradient, assuming we also correct for it in the gradient computation. The experiments clearly show the benefit of the proposed approach. The work is a nice combination/unification of two prominent trends in RL (with the overarching goal of reducing sample complexity, which is of course crucial here), and I believe is absolutely worth accepting. The authors also did an excellent job responding to reviewer concerns and adjusting the manuscript to address any issues raised.
 
 Pros:
 + Nice contribution combining off-policy and on-policy methods, with a novel and compelling algorithm
 + Good evaluation on a wide variety of control tasks
 
 Cons:
 - Somewhat difficult to understand (the interpretation I give above is not quite how the paper is presented, though I believe they are equivalent), and the given presentation is somewhat dense at time"
134,r1VdcHcxx,Accept (Poster),Recurrent Batch Normalization,"We propose a reparameterization of LSTM that brings the benefits of batch normalization to recurrent neural networks. Whereas previous works only apply batch normalization to the input-to-hidden transformation of RNNs, we demonstrate that it is both possible and beneficial to batch-normalize the hidden-to-hidden transition, thereby reducing internal covariate shift between time steps.

We evaluate our proposal on various sequential problems such as sequence classification, language modeling and question answering. Our empirical results show that our batch-normalized LSTM consistently leads to faster convergence and improved generalization.","['Deep learning', 'Optimization']","The reviewers believe this paper is of significant interest to the ICLR community, as it demonstrates how to get the popular batch normalization method to work in the recurrent setting. The fact that it has already been cited a variety of times also speaks to its interest within the community. The extensive experiments are convincing that the method works. One common criticism is that the authors don't address enough the added computational cost of the method in the text or empirically. Plots showing loss as a function of wall-clock time instead of training iteration would be more informative to readers deciding whether to use batch norm. 
 
 Pros: 
 - Gets batch normalization to work on recurrent networks (which had been elusive to many)
 - The experiments are thorough and demonstrate the method reduces training time (as a function of training iterations)
 - The paper is well written and accessible
 
 Cons
 - The contribution is relatively incremental (several tweaks to an existing method)
 - The major disadvantage to the approach is the added computational cost, but this is conspicuously not addressed."
135,BkVsEMYel,Accept (Poster),Inductive Bias of Deep Convolutional Networks through Pooling Geometry,"Our formal understanding of the inductive bias that drives the success of convolutional networks on computer vision tasks is limited. In particular, it is unclear what makes hypotheses spaces born from convolution and pooling operations so suitable for natural images. In this paper we study the ability of convolutional networks to model correlations among regions of their input. We theoretically analyze convolutional arithmetic circuits, and empirically validate our findings on other types of convolutional networks as well. Correlations are formalized through the notion of separation rank, which for a given partition of the input, measures how far a function is from being separable. We show that a polynomially sized deep network supports exponentially high separation ranks for certain input partitions, while being limited to polynomial separation ranks for others. The network's pooling geometry effectively determines which input partitions are favored, thus serves as a means for controlling the inductive bias. Contiguous pooling windows as commonly employed in practice favor interleaved partitions over coarse ones, orienting the inductive bias towards the statistics of natural images. Other pooling schemes lead to different preferences, and this allows tailoring the network to data that departs from the usual domain of natural imagery. In addition to analyzing deep networks, we show that shallow ones support only linear separation ranks, and by this gain insight into the benefit of functions brought forth by depth - they are able to efficiently model strong correlation under favored partitions of the input.","['Theory', 'Deep learning']","The paper uses the notion of separation rank from tensor algebra to analyze the correlations induced through convolution and pooling operations. They show that deep networks have exponentially larger separation ranks compared to shallow ones, and thus, can induce a much richer correlation structure compared to shallow networks. It is argued that this rich inductive bias is crucial for empirical success.
 
 The paper is technically solid. The reviewers note this, and also make a few suggestions on how to make the paper more accessible. The authors have taken this into account. In order to bridge the gap between theory and practice, it is essential for theory papers to be accessible.
 
 The paper covers related work pretty well. One aspect is misses is the recent geometric analysis of deep learning. Can the algebraic analysis be connected to geometric analysis of deep learning, e.g. in the following paper?
 https://arxiv.org/abs/1606.05340"
